{
  "$schema": "https://json-schema.org/draft/2020-12/schema",
  "title": "Aanbod op een vacature",
  "description": "Aanbod van een kandidaat door een andere instantie. Bevat geen naam; contact loopt via het functionele adres.",
  "type": "object",
  "properties": {
    "id": {
      "type": "string",
      "format": "uuid",
      "description": "Id van dit bericht. Bepaalt de idempotentie."
    },
    "vacancy_id": {
      "type": "string",
      "format": "uuid",
      "description": "Id van de vacature."
    },
    "organisation": {
      "$ref": "organisation-ref.schema.json"
    },
    "candidate_reference": {
      "type": "string",
      "description": "Verwijzing naar de kandidaat die alleen de aanbieder kan herleiden."
    },
    "profile": {
      "type": "string",
      "description": "Korte, niet tot een persoon herleidbare schets van ervaring en vaardigheden."
    },
    "available_from": {
      "type": "string",
      "format": "date",
      "description": "Beschikbaar vanaf."
    },
    "fte": {
      "type": "string",
      "pattern": "^\\d+(\\.\\d+)?$",
      "description": "Beschikbare omvang in FTE. Exacte decimaal als tekst, geen floating point."
    },
    "contact_email": {
      "type": "string",
      "format": "email",
      "description": "Functioneel e-mailadres van de aanbieder."
    },
    "offered_at": {
      "type": "string",
      "format": "date-time",
      "description": "Moment van aanbieden. Met tijdzone (RFC 3339)."
    }
  },
  "required": [
    "id",
    "vacancy_id",
    "organisation",
    "candidate_reference",
    "fte",
    "contact_email",
    "offered_at"
  ]
}
