{
  "id": "8c9d0e1f-0000-4000-8000-000000000007",
  "vacancy_id": "7b8c9d0e-0000-4000-8000-000000000006",
  "organisation": {
    "tooi_uri": "https://identifier.overheid.nl/tooi/id/ministerie/mnre0000",
    "name": "Voorbeeldministerie",
    "unit_key": "directie-voorbeeld",
    "instance_uri": "https://grip.opdrachtgever.example"
  },
  "candidate_reference": "K-0042",
  "profile": "Vijf jaar ervaring als developer bij de overheid.",
  "available_from": "2026-07-01",
  "fte": "0.8",
  "contact_email": "detachering@opdrachtgever.example",
  "offered_at": "2026-06-02T13:00:00+02:00"
}
